Collection;Source;Original;Reasons for modication;Id;Text;Constraints;Negative;Type;ActionA;ActionB;Type;ActionA;ActionB;Type;ActionA;ActionB
1;1;;;0;The process starts when the SO: Angebot/Auftrag receives a subsidiary order.;1;FALSE;EXISTENCE;receive order;;;;;;;
1;1;;;1;The SO: Angebot/Auftrag prepares goods for shipment and then ships the goods, concurrently with preparing the goods and shipping them, the SO: Angebot/Auftrag prepares invoicing.;2;FALSE;PRECEDENCE;prepare goods;ship goods;PRECEDENCE;prepare goods;prepare invoicing;;;
1;1;;;2;In case the customer is subsidiary and the subsidiary relationship is not yet modeled, SO: Address- management adds parent company as invoicing address, then the SO: Angebot/Auftrag create the invoice.;3;TRUE;NONCOOCCURRENCE;the customer is subsidiary;subsidiary relationship is not yet modeled;PRECEDENCE;subsidiary relationship is not yet modeled;add parent company;PRECEDENCE;subsidiary relationship is not yet modeled;create invoice
1;1;;;3;Otherwise if the customer is independent or the subsidiary relationship is already modeled in ERP, the SO: Angebot/Auftrag directly creates the invoice.;3;FALSE;NONCOOCCURRENCE;the customer is independent;the subsidiary relationship is already modeled in ERP;PRECEDENCE;the subsidiary relationship is already modeled in ERP;create invoice;PRECEDENCE;the customer is independent;create invoice
1;1;;;4;Finally, the SO: Angebot/Auftrag sends the invoice.;1;FALSE;END;send invoice;;;;;;;
